25_SAV20060829T1-58	tāt kudet taŋ ōžī itt'iel'elle t'umu polgele l'elle polnyj ōj taŋ šoromopul jeŋrōl miestegele.	tāt kude-t taŋ ōžī itt'iel'elle t'umu pol-gele l'e-lle polnyj ō-j taŋ šoromo-pul jeŋrō-l mieste-gele.	ANPH:ADV become-SS DST.ATTR water after.a.little.while all floor(Rus.)-ACC exist-SS.SEQ full(Rus.) COP-IND.INTR.3SG DST.ATTR person-PL sleep-AN place-ACC	Таат кудэт таӈ оожии итчиэльэллэ чуму полгэлэ льэллэ полный оой таӈ шоромопул йэӈроол миэстэгэлэ.	Вода вскоре заполнила весь пол, где спали юноши.	Soon, the water filled the entire floor where the young men were sleeping.	そうなって、その水はまもなく、その床を一面に満たした、その人々が眠っている場所を。	82(25.5)
25_SAV20060829T1-59	pol t'umu ōžīŋōt kudej.	pol t'umu ōžī-ŋōt kude-j.	floor(Rus.) all water-TRANS become-IND.INTR.3SG	Пол чуму оожииӈоот кудэй.	Весь пол затопило.	The entire floor was flooded.	床はすっかり水浸しになった。	83(25.51)
25_SAV20060829T1-60	tabungele juöŋam,	tabun-gele juö-ŋam,	DST-ACC see-PL:IND.TR.3	Табунгэлэ йуөӈам.	Они увидели.	They saw it.	彼らはそれを見た、	83(25.52)
25_SAV20060829T1-61	mežžejŋi.	mežžej-ŋi.	wake.up:PFV-PL:IND.INTR.3	Мэжжэйӈи.	Заметили.	They noticed.	気づいた。	83(25.52)
25_SAV20060829T1-62	tabungele juödele mežžejŋam taŋ köjpepul.	tabun-gele juö-dele mežžej-ŋam taŋ köjpe-pul.	DST-ACC see-SS.SEQ wake.up:PFV-PL:IND.TR.3 DST.ATTR man-PL	Табунгэлэ йуөдэлэ мэжжэйӈам таӈ кѳйпэпул.	Увидев это, юноши заметили.	The young men saw it, they noticed.	それを見て気づいた、その若者たちは。	83(25.53)
25_SAV20060829T1-63	irkin köj örn'ej:	irkin köj örn'e-j:	one man shout-IND.INTR.3SG	Иркин кѳй ѳрньэй:	Один юноша закричал:	One young man shouted,	１人の若者が叫んだ：	83(25.54)
25_SAV20060829T1-64	“t'ugōn t'ugōn!” moni.	“t'ugōn t'ugōn!” mon-i.	quickly quickly  say-IND.INTR.3SG	«Чугоон чугоон! — мони.	«Быстрей, быстрей!	“Hurry up, quickly!	「はやく、はやく！	83(25.55)
25_SAV20060829T1-65	“kebet'īli kebet'īli!	“kebe-t'īli kebe-t'īli!	leave:PFV-IND.INTR.1PL leave:PFV-IND.INTR.1PL	— Кэбэчиили кэбэчиили!	Давайте уходить!	Let's get out!	行こう、行こう！	83(25.55)
25_SAV20060829T1-66	ukejŋik ukejŋik!	ukej-ŋik ukej-ŋik!	go.out:PFV-PL:IMP.2 go.out:PFV-PL:IMP.2	Укэйӈик укэйӈик!	Выходите на улицу!	Get out!	外へ出ろ、外へ出ろ！	83(25.55)
25_SAV20060829T1-67	ōžīge amdett'īli!”	ōžī-ge amde-tt'īli!”	water-LOC die-FUT:IND.INTR.1PL	Оожиигэ амдэтчиили!»	Так мы утонем и умрём!»	Or else we'll drown and die!”	水の中で死んでしまうぞ！」	83(25.55)
25_SAV20060829T1-68	tāt'ile oknodaŋil' laŋi juödeŋi.	tāt'ile oknodaŋil' laŋi juöde-ŋi.	then window to see:DETR-PL:IND.INTR.3	Таачилэ окнодаӈиль лаӈи йуѳдэӈи.	И они посмотрели в сторону окна.	They glanced toward the window.	それから窓の方を見た。	83(25.56)
25_SAV20060829T1-69	tāt'ile oknodaŋil' laŋi juöŋam,	tāt'ile oknodaŋil' laŋi juö-ŋam,	then window to see-PL:IND.TR.3	Таачилэ окнодаӈиль лаӈи йуөӈам.	Посмотрели в сторону окна.	They glanced toward the window.	それから窓の方を見た。	83(25.57)
25_SAV20060829T1-70	oknohon ōžī, tiŋ oknohon taŋ oknohon ōžī.	okno-hon ōžī, tiŋ okno-hon taŋ okno-hon ōžī.	window(Rus.)-PROL water PROX:ATTR window(Rus.)-PROL DST.ATTR window(Rus.)-PROL water	Окноҕон оожии, тиӈ окноҕон таӈ окноҕон оожии.	Из этого окна, из того окна начала течь вода.	The water started leaking through the window.	窓から水が入ってきた、こっちの窓から、あっちの窓から。	83(25.58)
25_SAV20060829T1-71	taŋ köjpepul tamiŋam.	taŋ köjpe-pul tami-ŋam.	DST.ATTR man-PL dress.oneself-PL:IND.TR.3	Таӈ кѳйпэпул тамиӈам.	Юноши оделись.	The young men put their clothes on.	若者たちは服を着た。	83(25.59)
25_SAV20060829T1-72	tude nierpe tamidele pude laŋide šewrejŋi.	tude nier-pe tami-dele pude laŋide šewrej-ŋi.	3SG:GEN cloth-PL dress.oneself-SS.SEQ outside to escape:PFV-PL:IND.INTR.3	Тудэ ниэрпэ тамидэлэ пудэ лаӈидэ шэурэйӈи.	Они оделись и выбежали на улицу.	They got dressed and ran outside.	彼らは服を着て外へ逃げた。	83(25.6)
25_SAV20060829T1-73	taŋ pulundie numeget örn'ej, šešpedaŋil' johodajdele.	taŋ pulun-die nume-get örn'e-j, šešpedaŋil' johodaj-dele.	DST.ATTR old.man-DIM house-ABL shout-IND.INTR.3SG door open:CAUS:PFV-SS.SEQ	Таӈ пулундиэ нумэгэт ѳрньэй, шэшпэдаӈиль йоҕодайдэлэ.	Старик через дверь им крикнул.	The old man yelled at them through the door.	そのおじいさんは家の中から叫んだ、ドアを開けて。	83(25.61)
25_SAV20060829T1-74	terikiedie āj.	terikie-die āj.	old.woman-DIM again	Тэрикиэдиэ аай.	Старуха тоже крикнула.	The old woman yelled too.	おばあさんも叫んだ。	83(25.62)
25_SAV20060829T1-75	numeget örn'eŋi, šešpedaŋil' johodajdele.	nume-get örn'e-ŋi, šešpedaŋil' johodaj-dele.	house-ABL shout-PL:IND.INTR.3 door open:CAUS:PFV-SS.SEQ	Нумэгэт ѳрньэӈи, шэшпэдаӈиль йоҕодайдэлэ.	Они закричали из дома, открыв дверь.	They shouted from the house, opening the door.	彼らは家の中から叫んだ、ドアを開けて。	83(25.63)
25_SAV20060829T1-76	pulundiedie moni.	pulun-die-die mon-i.	old.man-DIM-DIM say-IND.INTR.3SG	Пулундиэдиэ мони.	Старик сказал.	The old man said and	おじいさんは言った。	83(25.64)
25_SAV20060829T1-77	tude nugene tāt ām.	tude nugen-e tāt ā-m.	3SG:GEN hand-INS ANPH:ADV make-IND.TR.3SG	Тудэ нугэнэ таат аам.	Вот так вот указал рукой.	He showed with his hand.	手をこんな風にした（指さした）。	83(25.64)
25_SAV20060829T1-78	pulundiedie moni, nugene āde:	pulun-die-die mon-i, nugen-e ā-de:	old.man-DIM-DIM say-IND.INTR.3SG hand-INS make-SS.SIM	Пулундиэдиэ мони, нугэнэ аадэ.	Старик сказал, вот так вот указывая рукой.	The old man said, showing with his hand,	おじいさんは言った、手をこんな風にしながら（指さしながら）：	83(25.65)
25_SAV20060829T1-79	“titket mit t'āšet t'umu amdett'īli tiŋ ōžīge.	“tit-ket mit t'āšet t'umu amde-tt'īli tiŋ ōžī-ge.	2PL-ABL 1PL now all die-FUT:IND.INTR.1PL PROX:ATTR water-LOC	«Титкэт мит чаашэт чуму амдэтчиили тиӈ оожиигэ.	«Из-за вас мы сейчас все умрём, утонув в воде.	“Now, we all will die because of you, drowned in the water.	「おまえたちのせいでわたしたちは皆死んでしまうだろう、この水の中で。	83(25.66)
25_SAV20060829T1-80	mit nume jalhilŋōt kudedil l'ej.”	mit nume jalhil-ŋōt kude-dil l'e-j.”	1PL house lake-TRANS become-PURP exist-IND.INTR.3SG	Мит нумэ йалҕилӈоот кудэдил льэй».	Наш дом становится озером».	Our house is turning into the lake.”	わたしたちの家は湖になろうとしている」	83(25.67)
25_SAV20060829T1-81	itt'iel'elle pulundie juöm.	itt'iel'elle pulun-die juö-m.	after.a.little.while old.man-DIM see-IND.TR.3SG	Итчиэльэллэ пулундиэ йуѳм.	Вскоре старик посмотрел.	Soon, the old man watched	しばらくしておじいさんは見た。	83(25.68)
25_SAV20060829T1-82	terikiedien'e ōžī molho qonŋi taŋide.	terikie-die-n'e ōžī molho qon-ŋi taŋide.	old.woman-DIM-COM water in go-PL:IND.INTR.3 DST.DIR	Тэрикиэдиэньэ оожии молҕо хонӈи таӈидэ.	Вода залила его с старухой.	The water flowing over him and the old woman.	おばあさんと一緒に水に流されようとしていた。	83(25.68)
25_SAV20060829T1-83	tāt juöŋam tude marqil'gele.	tāt juö-ŋam tude marqil'-gele.	ANPH:ADV see-PL:IND.TR.3 3SG:GEN girl-ACC	Таат йуөӈам тудэ мархильгэлэ.	Посмотрели на свою дочь.	They looked for their daughter.	そして彼らは見た、自分たちの娘を。	83(25.69)
25_SAV20060829T1-84	örn'eŋi:	örn'e-ŋi:	shout-PL:IND.INTR.3	Өрньэӈи:	Они закричали:	They shouted,	叫んだ：	83(25.7)
25_SAV20060829T1-85	“qadunge l'ejek?	“qadun-ge l'e-jek?	which-LOC exist-IND.INTR.2SG	«Хадунгэ льэйэк?	«Ты где?	“Where are you?	「おまえはどこにいるのか？	83(25.71)
25_SAV20060829T1-86	qadunge l'ejek?	qadun-ge l'e-jek?	which-LOC exist-IND.INTR.2SG	Хадунгэ льэйэк?	Где ты?	Where are you?	どこにいるのか？	83(25.71)
25_SAV20060829T1-87	keluk keluk!”	kelu-k kelu-k!”	come-IMP.2SG come-IMP.2SG	Кэлук кэлук!»	Выходи, выходи!»	Get out, get out!”	おいで、おいで！」	83(25.71)
25_SAV20060829T1-88	marqil' öjl'e.	marqil' öjl'e-0.	girl not.exist(-IND.INTR.3SG)	Мархиль ѳйльэ.	Дочери нигде не было.	The daughter was nowhere.	娘はいなかった。	83(25.72)
25_SAV20060829T1-89	marqil' ōžīgede öjl'e,	marqil' ōžī-ge=de öjl'e-0,	girl water-LOC=EMPH not.exist(-IND.INTR.3SG)	Мархиль оожиигэ дэ ѳйльэ.	Дочери не было ни в воде.	The daughter was not in the water.	娘は水の中にもいなかった、	83(25.73)
25_SAV20060829T1-90	numegede öjl'e.	nume-ge=de öjl'e-0.	house-LOC=EMPH not.exist(-IND.INTR.3SG)	Нумэгэ дэ ѳйльэ.	Не было ни внутри дома.	Nor was she in the house.	家の中にもいなかった。	83(25.73)
25_SAV20060829T1-91	tudā taŋ šoromo, irkin nume āj l'iel'el jūke jukedie.	tudā taŋ šoromo, irkin nume āj l'ie-l'el-0 jūke juke-die.	before DST.ATTR person one house again exist-INFR(-IND.INTR.3SG) far far-DIM	Тудаа таӈ шоромо, иркин нумэ аай льиэльэл йуукэ йукэдиэ.	В то время чуть поодаль стоял ещё один дом.	At the time, there was one more house at some distance.	そのとき、少し遠いところに家があった。	83(25.74)
25_SAV20060829T1-92	taŋ numeŋin nume laŋin šewrejl'el taŋ marqil' mondin:	taŋ nume-ŋin nume laŋin šewrej-l'el-0 taŋ marqil' mon-din:	DST.ATTR house-DAT house until escape:PFV-INFR(-IND.INTR.3SG) DST.ATTR girl say-PURP	Таӈ нумэӈин нумэ лаӈин шэурэйльэл таӈ мархиль.	Дочка убежала в сторону того дома.	The daughter ran toward that house.	その家の方へ逃げた、その娘は、（次のように）言うために：	83(25.75)
25_SAV20060829T1-93	“medin met šoromopul ōžīge amdeŋi,	“medin met šoromo-pul ōžī-ge amde-ŋi,	soon 1SG person-PL water-LOC die-PL:IND.INTR.3	Мондин: «Мэдин мэт шоромопул оожиигэ амдэӈи.	Чтобы сказать: «Вся моя семья сейчас утонет в воде.	To tell them, “All my family will drown in the water now.	「もうすぐわたしの家族は水の中で死んでしまうでしょう。	83(25.76)
25_SAV20060829T1-94	amdedin l'eŋi.	amde-din l'e-ŋi.	die-PURP exist-PL:IND.INTR.3	Чтобы сказать: «Пожалуйста, помогите!»	Умирают.	They are going to die.	死んでしまうでしょう」	83(25.76)
25_SAV20060829T1-95	qamied'eŋik kimd'ešŋik.”	qamied'e-ŋik kimd'eš-ŋik.”	help:DETR-PL:IMP.2 stand.firm-PL:IMP.2	Хамиэдьэӈик кимэдьшӈик!» — мондин.	Пожалуйста, помогите!»	Help, please!”	「助けてください、お願いです」	84(25.77)
25_SAV20060829T1-96	mondin šubežiel'el.	mon-din šubežie-l'el-0.	say-PURP run-INFR(-IND.INTR.3SG)	Шубэжиэльэл.	Она побежала.	She ran there.	そう言うために彼女は走って行った。	84(25.78)
25_SAV20060829T1-97	tabunge tāt juöm, pulundiedie tiŋide.	tabun-ge tāt juö-m, pulun-die-die tiŋide.	DST-LOC ANPH:ADV see-IND.TR.3SG old.man-DIM-DIM PROX:DIR	Табунгэ таат йуѳм, пулундиэдиэ тиӈидэ.	Старик посмотрел сюда.	The old man looked around.	そして見た、おじいさんはこちらを。	84(25.79)
25_SAV20060829T1-98	terikiedie öjl'e.	terikie-die öjl'e-0.	old.woman-DIM not.exist(-IND.INTR.3SG)	Тэрикиэдиэ ѳйльэ.	Старухи не было.	There was no old woman.	おばあさんがいなかった。	84(25.8)
25_SAV20060829T1-99	t'emejl'el ōžī molho.	t'emej-l'el-0 ōžī molho.	end:PFV-INFR(-IND.INTR.3SG) water in	Чэмэйльэк оожии молҕо.	Она утонула в воде и умерла.	She had drowned in the water and died.	水に沈んでしまった。	84(25.81)
25_SAV20060829T1-100	itt'iel'elle pulundiedie āj.	itt'iel'elle pulun-die-die āj.	after.a.little.while old.man-DIM-DIM again	Итчиэльэллэ пулундиэдиэ аай.	Через некоторе время утонул и старик.	After a while, the old man drowned too.	まもなくしておじいさんも沈んだ。	84(25.82)
25_SAV20060829T1-101	nugene ām tol'ko.	nugen-e ā-m tol'ko.	hand-INS make-IND.TR.3SG only(Rus.)	Нугэнэ аам, только.	Он только сумел помахать рукой.	He'd been able to give only a wave of his hand.	指差しただけだった。	84(25.83)
25_SAV20060829T1-102	tāt'ile taŋ marqil' šubežiel'el.	tāt'ile taŋ marqil' šubežie-l'el-0.	then DST.ATTR girl run-INFR(-IND.INTR.3SG)	Таачилэ таӈ мархиль шубэжиэльэл.	Потом та девушка побежала.	Then, the girl began to run.	そしてその娘は走って行った。	84(25.84)
25_SAV20060829T1-103	šubeželle taŋ šoromopulge jaqal'el.	šubeže-lle taŋ šoromo-pul-ge jaqa-l'el-0.	run-SS.SEQ DST.ATTR person-PL-LOC arrive-INFR(-IND.INTR.3SG)	Шубэжэллэ таӈ шоромопулгэ йахальэл.	Она побежала и пришла в их дом.	She ran and came to their (neighbors') house.	彼女は走って行って、その人々のところに着いた。	84(25.85)
25_SAV20060829T1-104	jaqadele moll'el:	jaqa-dele mol-l'el-0:	arrive-SS.SEQ say-INFR(-IND.INTR.3SG)	Йахадэлэ молльэл:	Прибежав, она сказала:	She came running and said,	たどり着いて言った：	84(25.86)
25_SAV20060829T1-105	“met emej et'ie adipe ōžīge t'emerejŋi,” moni.	“met emej et'ie adi-pe ōžī-ge t'emerej-ŋi,” mon-i.	1SG mother father young.man-PL water-LOC end:CAUS:PFV-PL:IND.INTR.3 say-IND.INTR.3SG	«Мэт эмэй, эчиэ, йаад адипэ оожиигэ чэмэрэйӈи, — мони.	«Моя мать, отец и три парня утонули в воде.	“My mother, my father, and three fellows drowned in the water.	「わたしの母、父、若者たちが水に沈んでしまいました。	84(25.87)
25_SAV20060829T1-106	“tāt löwdūŋi.	“tāt löwdū-ŋi.	ANPH:ADV fall-PL:IND.INTR.3	Таат лөудууӈи.	Они упали в воду.	They've drowned in the water.	水の中に落ちてしまいました。	84(25.88)
25_SAV20060829T1-107	mit nume jalhilŋōt kudej.”	mit nume jalhil-ŋōt kude-j.”	1PL house lake-TRANS become-IND.INTR.3SG	Мит нумэ йалҕилӈоот кудэй».	Наш дом превратился в озеро».	Our house has turned into the lake.”	わたしたちの家は湖になってしまいました」	84(25.89)
25_SAV20060829T1-108	tabunge taŋ šoromopul kell'elŋi.	tabun-ge taŋ šoromo-pul kel-l'el-ŋi.	DST-LOC DST.ATTR person-PL come-INFR-PL:IND.INTR.3	Табунгэ таӈ шоромопул кэлльэлӈи.	Затем те люди пришли.	Then those people came.	そして、その人々が来た。	84(25.9)
25_SAV20060829T1-109	jān šoromo kell'el.	jān šoromo kel-l'el-0.	three person come-INFR(-IND.INTR.3SG)	Йаан шоромо кэлльэл.	Пришли трое людей.	Three men came.	３人の人がやって来た。	84(25.91)
25_SAV20060829T1-110	ē, marqil' qoll'el.	ē, marqil' qol-l'el-0.	INTJ girl go-INFR(-IND.INTR.3SG)	Ээ, мархиль холльэл.	А-а, это дочка пошла.	Ah, that was the daughter who went.	ああ、娘が行ったのだった。	84(25.92)
25_SAV20060829T1-111	jaqadele šoromopulŋin moni:	jaqa-dele šoromo-pul-ŋin mon-i:	arrive-SS.SEQ person-PL-DAT say-IND.INTR.3SG	Йахадэлэ шоромопулӈмн мони:	Она пришла и сказала людям:	She came to the people and said,	彼女はたどり着いて人々に言った：	84(25.93)
25_SAV20060829T1-112	“amdejli,	“amde-jli,	die-IND.INTR.1PL	«Амдэйли.	«Мы умрём.	“We'll die.	「わたしたちは死んでしまいます。	84(25.94)
25_SAV20060829T1-113	met emej et'ie jād adipe ōžīge amdeŋi,	met emej et'ie jād adi-pe ōžī-ge amde-ŋi,	1SG mother father three young.man-PL water-LOC die-PL:IND.INTR.3	Мэт эмэй эчиэ адипэ оожиигэ амдэӈи.	Моя мать, отец, три парня погибли в воде.	My mother, father, and three fellows died in the water.	わたしの母と父、３人の若者たちは水の中で死んでしまいました。	84(25.94)
25_SAV20060829T1-114	mit nume jalhilŋōt kudej.”	mit nume jalhil-ŋōt kude-j.”	1PL house lake-TRANS become-IND.INTR.3SG	Мит нумэ йалҕилӈоот кудэй».	Наш дом превратился в озеро».	Our house turned into the lake.”	わたしたちの家は湖になってしまいました」	84(25.95)
25_SAV20060829T1-115	tāt'ile taŋ šoromopul kell'elŋi ien numeget.	tāt'ile taŋ šoromo-pul kel-l'el-ŋi ien nume-get.	then DST.ATTR person-PL come-INFR-PL:IND.INTR.3 other house-ABL	Таачилэ таӈ шоромопул кэлльэлӈи иэн нумэгэт.	Затем пришли те люди из другого дома.	Then those people from the other house came.	そしてその人々がやって来た、もう一軒の家から。	84(25.96)
25_SAV20060829T1-116	tāt'ile juöŋam.	tāt'ile juö-ŋam.	then see-PL:IND.TR.3	Таачилэ йуөӈам.	Они посмотрели.	They looked.	そして見た。	84(25.97)
25_SAV20060829T1-117	n'elemedie öjl'e.	n'eleme-die öjl'e-0.	INDF:what-DIM not.exist(-IND.INTR.3SG)	Ньэ лэмэдиэ ѳйльэ.	Там ничего не было.	There was nothing.	何もなかった。	84(25.97)
25_SAV20060829T1-118	nume el_ohō.	nume el=ohō-0.	house NEG=stand(-IND.INTR.3SG)	Нумэ эл оҕоо.	Дома нет.	There was no house.	家はなかった。	84(25.98)
25_SAV20060829T1-119	t'umu jalhilŋōt kudedele ohōj.	t'umu jalhil-ŋōt kude-dele ohō-j.	all lake-TRANS become-SS.SEQ stand-IND.INTR.3SG	Чуму йалҕилӈоот кудэдэлэ оҕоой.	Всё превратилось в озеро.	Everything had turned into the lake.	すっかり湖になっていた。	84(25.99)
25_SAV20060829T1-120	irkin šoromo tā jalhil jeklie qoll'el.	irkin šoromo tā jalhil jeklie qol-l'el-0.	one person DST.LOC lake beyond go-INFR(-IND.INTR.3SG)	Иркин шоромо таа йалҕил йэклиэ холльэл.	Потом один из этих людей направился на другую сторону озера.	Then, one of those people headed towards the other side of the lake.	のちに１人の人がその湖の向こうに行ったそうだ。	84(25.1)
25_SAV20060829T1-121	qondele juöm.	qon-dele juö-m.	go-SS.SEQ see-IND.TR.3SG	Хондэлэ йуѳм.	Тот человек пошёл и увидел.	The man went and saw.	その人は行って、そして見た。	84(25.101)
25_SAV20060829T1-122	juödege taŋ jalhilge ōqill'āpe ejreŋi ninget.	juö-dege taŋ jalhil-ge ōqill'ā-pe ejre-ŋi ninge-t.	see-POSS.3:DS DST.ATTR lake-LOC perch-PL walk-PL:IND.INTR.3 be.many-SS	Йуѳдэгэ таӈ йалҕилгэ оохилльаапэ эйрэӈи нингэт.	Увидел, что в озере плавают много окуней.	He saw many perches swimming in the lake.	見ると、その湖にはカワスズキがたくさん泳いでいた。	84(25.102)
25_SAV20060829T1-123	tabunget monŋi:	tabun-get mon-ŋi:	DST-ABL say-PL:IND.INTR.3	Табунгэт монӈи:	Поэтому люди так и говорят:	Therefore, people say,	だから人々は言う：	84(25.103)
25_SAV20060829T1-124	“šoromo mondejne, liged'e šoromo ažūgi medik.	“šoromo mon-dejne, lige-d'e šoromo ažū-gi medi-k.	person say-POSS.3:DS.COND be.old-JPTCP person word-POSS.3 hear-IMP.2SG	«Шоромо мондэйнэ, лигэдьэ шоромо ажууги мэдик.	«Если старый человек говорит что-нибудь, слушайте, что он говорит.	“When an old man says something, listen to what he is saying.	「人が何か言ったら、その年老いた人の言うことを聞きなさい。	84(25.104)
25_SAV20060829T1-125	el_meditejmet, tāt kudetejmet.”	el=medi-tejmet, tāt kude-tejmet.”	NEG=hear-FUT:IND.INTR.2PL ANPH:ADV become-FUT:IND.INTR.2PL	Эл мэдитэймэт, таат кудэтэймэт».	Если не слушаете, с вами будет вот так».	If you don't listen, the same thing will happen to you.”	聞かなければ、こんな風になってしまうぞ」	84(25.105)
26_SAV20070726T1-1	metke tiŋ n'amalhilge...	met-ke tiŋ n'amalhil-ge...	1SG-LOC PROX:ATTR year-LOC	Мэткэ тиӈ ньамалҕилгэ ...	Мне в этом году...	This year, I am ...	わたしは今年で...	85(26.1)
26_SAV20070726T1-2	ja_prosto_skazhu_sejchas.	ja_prosto_skazhu_sejchas.	I.will.just.tell.something.now(Rus.)	Я просто скажу сейчас.	— Я просто скажу сейчас.	I'll just say something now.	ひとこと言うよ。	85(26.1)
26_SAV20070726T1-3	potom_t'ūl'd'ī.	potom_t'ūl'd'ī.	then.I.will.tell.a.tale(Rus.)	Потом чуульдьии.	Потом сказку —	Then, I'll tell a tale.	それから昔話だ。	85(26.1)
26_SAV20070726T1-4	purkin_kun'el'_purkibudi n'amalhilŋōt kudej.	purkin_kun'el'_purkibudi n'amalhil-ŋōt kude-j.	seventy.seven year-TRANS become-IND.INTR.3SG	Пуркин куньэль пуркибуди ньамалҕилӈоот кудэй.	Мне исполнилось 77 лет.	I am 77 years old.	わたしは77才になった。	85(26.1)
26_SAV20070726T1-5	met ajī modot t'ūl'd'ī punduje.	met ajī modo-t t'ūl'd'ī pundu-je.	1SG still sit-SS tale tell-IND.INTR.1SG	Мэт айии модот чуульдьии пундуйэ.	Я ещё жива и рассказываю сказки.	I am still alive and telling fairy tales.	わたしはまだ生きていて、昔話を語る。	85(26.2)
26_SAV20070726T1-6	qodo amdātum?	qodo amdā-tum?	how die-FUT:INTERR.1SG	Ходо амдаатум?	Как я умру?	How can I die?	どうして死ねるだろうか？	85(26.3)
26_SAV20070726T1-7	monŋi: “punduk!” uörpe, keld'e uörpe.	mon-ŋi: “pundu-k!” uör-pe, kel-d'e uör-pe.	say-PL:IND.INTR.3 tell-IMP.2SG  child-PL come-JPTCP child-PL	Монӈи: «пундук», — уөрпэ кэлдьэ уөрпэ.	Говорят: «Расскажи сказку», — дети, которые приходят ко мне.	Children coming to me say: “Tell us a fairy tale.”	子供たちが「語ってくれ」と言う、訪ねて来る子供たちが。	85(26.4)
26_SAV20070726T1-8	d'e t'ūl'd'ī.	d'e t'ūl'd'ī.	INTJ tale	Дьэ чуульдьии.	Вот сказка.	Here is a fairy tale.	で、昔話だ。	85(26.5)
26_SAV20070726T1-9	t'āqadan unuŋgen nuŋenaŋil' jeklie irkin nume modol'elŋi.	t'āqadan unuŋ-gen nuŋenaŋil' jeklie irkin nume modo-l'el-ŋi.	the.river.Yasachnaya river-PROL the.mouth.of.river.Rassoxa beyond one house sit-INFR-PL:IND.INTR.3	Чаахадан унуӈгэн нуӈэнаӈиль йэклиэ иркин нумэ модольэлӈи.	На Ясачной, за устьем Рассохи жила одна семья.	In Yasachnaya, over the mouth of the river Rassokha, there lived one family.	ヤサチナ川沿い、ラソハ川河口の向こうに、ある家族が暮らしていた。	85(26.6)
26_SAV20070726T1-10	irkin marqil'n'āl'elŋi.	irkin marqil'-n'ā-l'el-ŋi.	one girl-PROP-INFR-PL:IND.INTR.3	Иркин мархильньаальэлӈи.	У них была одна дочка.	They had a daughter.	彼らには娘が１人いた。	85(26.7)
26_SAV20070726T1-11	irkin_kun'el n'amalhiln'ej.	irkin_kun'el n'amalhil-n'e-j.	ten year-PROP-IND.INTR.3SG	Иркин куньэл ньамалҕилньэй.	Ей было 10 лет.	She was 10 years old.	彼女は１０才だった。	85(26.8)
