14_ShAG19970808T2-159	“met,” moni, “metn'e met tetul ket'īlōl el, nilgiŋin el_pundulek,” moni.	“met,” mon-i, “met-n'e met tet-ul ket'ī-l-ōl el=, nilgi-ŋin el=pundu-lek,” mon-i.	1SG say-IND.INTR.3SG 1SG-COM 1SG 2SG-ACC bring-E-RN {} anyone-DAT NEG=tell-PROH.2SG say-IND.INTR.3SG	«Мэт, — мони, — мэтньэ мэт тэтул кэчиилоол эл... нилгиӈин эл пундулэк», — мони.	«Не говори никому, что это я тебя привёз!»	“Don't tell anybody that I brought you here!.”	「わたしがおまえを連れて来たことを誰にも話してはならないぞ」	51(14.105)
14_ShAG19970808T2-160	d'e tātl'elle kebet'.	d'e tātl'elle kebe-t'.	INTJ then leave:PFV-IND.INTR.3SG	Дьэ таат льэллэ кэбэч.	И уехал.	And he left.	そして去った。	51(14.106)
14_ShAG19970808T2-161	tude numeŋin meriet'.	tude nume-ŋin merie-t'.	3SG:GEN house-DAT fly:PFV-IND.INTR.3SG	Тудэ нумэӈин мэриэч.	Он улетел в свой дом.	He flew back home.	自分の家へ飛び去った。	51(14.106)
14_ShAG19970808T2-162	d'e pieter_berbekin lemen nadaŋōd'ōngele ket'ītemlebengele t'umu ket'īm.	d'e pieter_berbekin leme-n nādaŋō-d'ōn-gele ket'ī-temle=ben-gele t'umu ket'ī-m.	INTJ Pieter.Berbekin what-GEN be.necessary-JPTCP:NMLZ-ACC bring-FUT:MPTCP.3SG=NMLZ-ACC all bring-IND.TR.3SG	Дьэ Пиэтэр Бэрбэкин лэмэн наадаӈоодьоонгэлэ кэчиитэмлэ бэнгэлэ чуму кэчиим.	Все те важные вещи, которые Пиэтэр Бэрбэкин должен был привезти, он всё привёз.	All the important things Pieter Berbekin should have brought back there, he brought.	ピエテル ベルベキンは何か必要なものを、自分が運んで来るはずだったものをすべて運んで来た。	51(14.107)
14_ShAG19970808T2-163	d'e, immulle, ōžešl'elŋā.	d'e, immu-lle, ōžeš-l'el-ŋā.	INTJ get.drunk-SS.SEQ drink:CAUS-INFR-PL:IND.TR.3	Дьэ иммуллэ, оожэшльэлӈаа.	Он опьянел, все стали поить его.	He got drunk, as everybody gave him a drink.	彼は酔っ払った、飲まされた。	51(14.108)
14_ShAG19970808T2-164	tāt ugijelme uket'.	tāt ugijel-me uke-t'.	ANPH:ADV morning-TMP go.out:PFV-IND.INTR.3SG	Таат угийэлмэ укэч.	На следующее утро он вышел на улицу.	The next morning, he went out.	そして翌朝、外へ出た。	51(14.109)
14_ShAG19970808T2-165	tintaŋ bogatyr' endī n'āt'edege, n'āt'ede kiejie l'ej.	tintaŋ bogatyr' endī n'āt'e-de-ge, n'āt'e-de kiejie l'e-j.	ANPH:ATTR hero(Rus.) MED:LOC face-POSS.3-LOC face-POSS.3:GEN before exist-IND.INTR.3SG	Тинтаӈ богатырь эндии ньаачэдэгэ, ньаачэдэ киэйиэ льэй.	Тот богатырь стоял здесь, перед ним.	That very Bogatyr was standing in front of him.	あの勇士がここに、彼の目の前にいた。	51(14.109)
14_ShAG19970808T2-166	“met tetin el_mod'e?” moni.	“met tet-in el=mo-d'e?” mon-i.	1SG 2SG-DAT NEG=say-IND.INTR.1SG  say-IND.INTR.3SG	«Мэт тэтин эл модьэ? — мони.	«Разве я тебе не говорил?	“Didn't I tell you	「わたしはおまえに言わなかったか？	51(14.11)
14_ShAG19970808T2-167	“metn'e met tetul ket'īlōl el_pundulek.”	“met-n'e met tet-ul ket'ī-l-ōl el=pundu-lek.”	1SG-COM 1SG 2SG-ACC bring-E-RN NEG=tell-PROH.2SG	— Мэтньэ... мэт тэтул кэчиилоол эл пундулэк».	Чтобы ты не рассказывал никому, что это я тебя привёз».	Not to tell anyone that I brought you here?”	わたしがおまえを連れて来たことを話すなと」	51(14.11)
14_ShAG19970808T2-168	“eto el_metek tāt l'el,” moni.	“eto el=met-ek tāt l'e-l,” mon-i.	this.one(Rus.) NEG=1SG-FOC ANPH:ADV exist-SF say-IND.INTR.3SG	«Это эл мэтэк таат льэл, — мони.	«Это не я сделал, — сказал Пиэтэр Бэрбэкин.	“It wasn't me who did it,” said Pieter Berbekin.	「それはわたしがやったんじゃないさ。	51(14.111)
14_ShAG19970808T2-169	eto khmel'ek tāt l'el.	eto khmel'-ek tāt l'e-l.	this.one(Rus.) alcohol(Rus.)-FOC ANPH:ADV exist-SF	— Это хмельэк таат льэл.	— Это всё хмель сделал.	“Tipsiness did it all.	酒がやったんだ。	51(14.111)
14_ShAG19970808T2-170	khmel', tudel metkele ann'ešum.”	khmel', tudel met-kele ann'eš-u-m.”	alcohol(Rus.) 3SG 1SG-ACC speak:CAUS-E-IND.TR.3SG	Хмель, тудэл мэткэлэ анньэшум».	Это хмель заставил меня рассказывать».	It was tipsiness that made me talk.”	酒がわたしに喋らせたんだ」	51(14.112)
14_ShAG19970808T2-171	“lemdik tamun khmel' monōlben?	“lem-dik tamun khmel' monō-l=ben?	what-PRD DST alcohol(Rus.) say:RES-AN=NMLZ	«Лэмдик тамун хмель моноол бэн?	«Что это такое — хмель?	“What is it, tipsiness?	「何だそれは、その酒ってのは？	51(14.113)
14_ShAG19970808T2-172	tet metin ket'īk!” moni.	tet met-in ket'ī-k!” mon-i.	2SG 1SG-DAT bring-IMP.2SG  say-IND.INTR.3SG	Тэт мэтин кэчиик!» — мони.	Ты принеси мне!»	Bring it to me!”	わたしに持って来い！」	51(14.114)
14_ShAG19970808T2-173	lemen bochonok, bochonokkele qontom.	leme-n bochonok, bochonok-kele qonto-m.	what-GEN cask(Rus.) cask(Rus.)-ACC go:CAUS-IND.TR.3SG	Лэмэн бочонок, бочоноккэлэ хонтом.	Пиэтэр Бэрбэкин принёс какой-то маленький бочонок.	Pieter Berbekin brought a small keg.	ピエテル・ベルベキンは小さな樽を運んで来た。	51(14.115)
14_ShAG19970808T2-174	“tuön ōžek!” moni.	“tuön ōže-k!” mon-i.	PROX drink-IMP.2SG  say-IND.INTR.3SG	«Туѳн оожэк! — мони.	«Выпей это!	“Drink it!	「これを飲め！	51(14.116)
14_ShAG19970808T2-175	“ugijelme met tetul juöjīt.”	“ugijel-me met tet-ul juö-jī-t.”	morning-TMP 1SG 2SG-ACC see-VEN-FUT:IND.TR.1SG	— Угийэлмэ мэт тэтул йуѳйиит».	Завтра утром я приду посмотреть на тебя».	Tomorrow morning, I'll come to look at you.”	明日の朝わたしはおまえを見に来よう」	51(14.116)
14_ShAG19970808T2-176	d'e numeŋin kebet'.	d'e nume-ŋin kebe-t'.	INTJ house-DAT leave:PFV-IND.INTR.3SG	Дьэ нумэӈин кэбэч.	Пиэтэр Бэрбэкин пошёл домой.	Pieter Berbekin went home.	（ピエテル・ベルベキンは）家へ去った。	51(14.117)
14_ShAG19970808T2-177	ugijelme kiet'.	ugijel-me kie-t'.	morning-TMP come-IND.INTR.3SG	Угийэлмэ киэч.	На следующее утро он пришёл.	The next morning, he arrived.	翌朝やって来た。	51(14.118)
14_ShAG19970808T2-178	tintaŋ bogatyr' taŋ khmel' ōželle lemen l'eplek jamaplek āl'elmele.	tintaŋ bogatyr' taŋ khmel' ōže-lle leme-n l'e-pl-ek jama-pl-ek ā-l'el-mele.	ANPH:ATTR hero(Rus.) DST.ATTR alcohol(Rus.) drink-SS.SEQ what-GEN that.one-PL-FOC hole(Rus.)-PL-FOC make-INFR-OF.3SG	Тинтаӈ богатырь таӈ хмель оожэллэ лэмэн льэплэк йамаплэк аальэлмэлэ.	Тот богатырь, выпив хмеля, сделал ямы.	The Bogatyr, drunk on tipsiness, had made pits.	その勇士は酒を飲んで、穴を掘っていた。	51(14.119)
14_ShAG19970808T2-179	piepelek ūjl'elmele.	pie-pe-lek ūj-l'el-mele.	hill-PL-FOC make-INFR-OF.3SG	Пиэпэлэк уйиильэлмэлэ.	Сделал горы.	And he had made mountains.	山を作っていた。	51(14.119)
14_ShAG19970808T2-180	“id'ī juök,” moni.	“id'ī juö-k,” mon-i.	now see-IMP.2SG say-IND.INTR.3SG	«Идьии йуѳк, — мони.	«Теперь смотри.	“Now, look!	「ほら見ろ。	51(14.12)
14_ShAG19970808T2-181	“d'e met ubuj moll'eld'e tetin.	“d'e met ubuj mol-l'el-d'e tet-in.	INTJ 1SG that's.right say-INFR-IND.INTR.1SG 2SG-DAT	— Дьэ мэт убуй молльэлдьэ тэтин.	Я же тебе правду говорил.	I told you the truth.	わたしはおまえに本当のことを言っただろう。	51(14.12)
14_ShAG19970808T2-182	el_metek tāt l'el.	el=met-ek tāt l'e-l.	NEG=1SG-FOC ANPH:ADV exist-SF	Эл мэтэк таат льэл.	Это не я сам сделал.	It was not me who did it.	わたしがやったんじゃない。	51(14.12)
14_ShAG19970808T2-183	khmel'ek!”	khmel'-ek!”	alcohol(Rus.)-PRD	Хмельэк!»	Это хмель сделал!»	The tipsiness did it!”	酒なんだ」	51(14.12)
14_ShAG19970808T2-184	“pieter_berbekin, tet tet omot' āmek.	“pieter_berbekin, tet tet omot' ā-mek.	Pieter.Berbekin 2SG 2SG well make-IND.TR.2SG	«Пиэтэр Бэрбэкин, тэт тэт омоч аамэк.	«Пиэтэр Бэрбэкин, ты был прав!	“Pieter Berbekin, you were right!	（勇士は言った）「ピエテル・ベルベキンよ、おまえはよくやった。	51(14.121)
14_ShAG19970808T2-185	tet omot' ūjl'elmek.	tet omot' ūj-l'el-mek.	2SG well make-INFR-IND.TR.2SG	Тэт омоч уйиильэлмэк.	Ты сделал хорошо.	Well done.	おまえはよくやったようだ。	51(14.121)
14_ShAG19970808T2-186	id'ī metn'e kelōl iskom tabude šoromoŋin nied'irīk.”	id'ī met-n'e kel-ōl iskom tabud-e šoromo-ŋin nied'irī-k.”	now 1SG-COM come-RN always DST-INS person-DAT talk:APPL-IMP.2SG	Идьии мэтньэ кэлоол иском табудэ шоромоӈин ниэдьириик».	Теперь ты можешь говорить кому угодно о том, что это ты со мной прилетел».	Now, you may tell everybody that you flew in with me.”	これからはわたしと来たことをいつも人々に話すがいい」	51(14.122)
14_ShAG19970808T2-187	n'ādude.	n'ādude.	that's.enough	Ньаадудэ.	Хватит.	That's enough.	おしまい。	52(14.123)
14_ShAG19970808T2-188	vsë.	vsë.	all(Rus.)	Всё	Всё.	That's all.	おしまい。	52(14.123)
15_ShAG20021012T-1	pieter_berbekingele janŋā, pochtaŋin, pochta qontodin.	pieter_berbekin-gele jan-ŋā, pochta-ŋin, pochta qonto-din.	Pieter.Berbekin-ACC send-PL:IND.TR.3 post(Rus.)-DAT post(Rus.) go:CAUS-PURP	Пиэтэр Бэрбэкингэлэ йанӈаа, почтаӈин, почта хонтодин.	Люди отправили Пиэтэра Бэрбэкина отнести почту.	People sent Pieter Berbekin to deliver mail.	ピエテル・ベルベキンを送った、郵便を運ぶために。	53(15.1)
15_ShAG20021012T-2	lemen pochtak taŋnigi l'iel'elul, kil lejdī.	leme-n pochta-k taŋnigi l'ie-l'el-u-l, kil lejdī-0.	what-GEN post(Rus.)-FOC then exist-INFR-E-SF who know(-INTERR.3SG)	Лэмэн почтак таӈниги льиэльэлул, кил лэйдии.	Какая почта в те времена была, кто знает?	Who knows what kind of mail was there in those days?	どんな郵便が当時あったのか、誰も知らない。	53(15.2)
15_ShAG20021012T-3	d'e pieter_berbekin tāt kebet'.	d'e pieter_berbekin tāt kebe-t'.	INTJ Pieter.Berbekin ANPH:ADV leave:PFV-IND.INTR.3SG	Дьэ Пиэтэр Бэрбэкин таат кэбэч.	И Пиэтэр Бэрбэкин пошёл.	And Pieter Berbekin left.	ピエテル・ベルベキンは出発した。	53(15.3)
15_ShAG20021012T-4	qonut qonut qonut qonut tāt šān'ejbenge jaqaj.	qon-u-t qon-u-t qon-u-t qon-u-t tāt šā-n'e-j=ben-ge jaqa-j.	go-E-SS go-E-SS go-E-SS go-E-SS ANPH:ADV tree-PROP-JPTCP=NMLZ-LOC arrive-IND.INTR.3SG	Хонут хонут хонут хонут таат шааньэй бэнгэ йахай.	Он шёл, шёл, шёл, шёл и дошёл до леса.	He walked, walked, walked, and walked and reached the forest.	ずっと行って、木の生えた所に着いた。	53(15.4)
15_ShAG20021012T-5	tamun tāt edied'el budit'.	tamun tāt edied'e-l budi-t'.	DST ANPH:ADV call:DETR-AN be.heard?-IND.INTR.3SG	Тамун таат эдиэдьэл будич:	Кто-то его позвал:	Somebody called out to him,	すると呼ぶのが聞こえた。	53(15.5)
15_ShAG20021012T-6	“pieter_berbekin, met laŋi keluk!”	“pieter_berbekin, met laŋi kelu-k!”	Pieter.Berbekin 1SG to come-IMP.2SG	«Пиэтэр Бэрбэкин, мэт лаӈи кэлук!»	«Пиэтэр Бэрбэкин, иди ко мне!»	“Pieter Berbekin, come to me!”	「ピエテル・ベルベキンよ、わたしの方へ来い！」	53(15.5)
15_ShAG20021012T-7	tā juödej.	tā juöde-j.	DST.LOC see:DETR-IND.INTR.3SG	Таа йуѳдэй.	Он посмотрел.	He looked.	見た。	53(15.6)
15_ShAG20021012T-8	taŋide juödej, qadunge ažū medū.	taŋide juöde-j, qadun-ge ažū medū-0.	DST.DIR see:DETR-IND.INTR.3SG which-LOC word be.heard(-INTERR.3SG)	Таӈидэ йуѳдэй хадунгэ ажуу мэдуу.	Он посмотрел туда, откуда послышался голос.	He looked to where the voice came from.	声の聞こえる方を見た。	53(15.6)
15_ShAG20021012T-9	öjl'e, n'eleme el_l'en.	öjl'e-0, n'eleme el=l'en-0.	not.exist(-IND.INTR.3SG) INDF:what NEG=be.visible(-IND.INTR.3SG)	Өйльэ, ньэ лэмэ эл льэн.	Нет, ничего не было видно.	No, nothing could be seen.	何も見えなかった。	53(15.7)
15_ShAG20021012T-10	“migide migide keluk!	“migide migide kelu-k!	PROX:DIR PROX:DIR come-IMP.2SG	«Мигидэ мигидэ кэлук!	«Сюда, сюда иди!	“Here, come here!	「こっちへ来い！	53(15.8)
15_ShAG20021012T-11	migide keluk!”	migide kelu-k!”	PROX:DIR come-IMP.2SG	мигидэ кэлук!»	Сюда иди!»	Сome here!”	こっちへ来い！」	53(15.8)
15_ShAG20021012T-12	qoni.	qon-i.	go-IND.INTR.3SG	Хони.	Он пошёл.	He went.	行った。	53(15.9)
15_ShAG20021012T-13	d'e qoni.	d'e qon-i.	INTJ go-IND.INTR.3SG	Дьэ хони.	Он пошёл.	He went.	​行った。	53(15.9)
15_ShAG20021012T-14	qadunge ažū medū taŋide qoni.	qadun-ge ažū medū-0 taŋide qon-i.	which-LOC word be.heard(-INTERR.3SG) DST.DIR go-IND.INTR.3SG	Хадунгэ ажуу мэдуу таӈидэ хони.	Пошёл туда, откуда шёл голос.	He went there, to the place the voice was coming from.	声の聞こえる方へ行った。	53(15.9)
15_ShAG20021012T-15	“migide keluk!	“migide kelu-k!	PROX:DIR come-IMP.2SG	«Мигидэ кэлук!	«Иди сюда!	“Come here!	「こっちへ来い！	53(15.1)
15_ShAG20021012T-16	migide keluk!”	migide kelu-k!”	PROX:DIR come-IMP.2SG	мигидэ кэлук!»	Иди сюда!»	Сome here!”	こっちへ来い！」	53(15.1)
15_ShAG20021012T-17	šālek ohōl, šālek, t'omōd'e šālek.	šāl-ek ohō-l, šāl-ek, t'omō-d'e šāl-ek.	tree-PRD stand-SF tree-PRD be.big-JPTCP tree-PRD	Шаалэк оҕоол, шаалэк, чомоодьэ шаалэк.	Стояло дерево, большое дерево.	There was a tree, a large tree.	木が立っていた、大きな木が。	53(15.1)
15_ShAG20021012T-18	tā jaqaj.	tā jaqa-j.	DST.LOC arrive-IND.INTR.3SG	Таа йахай.	Он подошёл к нему.	He came close to it.	そこに着いた。	53(15.11)
15_ShAG20021012T-19	apl'etāj titāt emledejm pieter_berbekingele.	apl'etāj titāt emledej-m pieter_berbekin-gele.	opletaj ANPH:ADV embrace-IND.TR.3SG Pieter.Berbekin-ACC	Апльэтаай титаат эмлэдэйм Пиэтэр Бэрбэкингэлэ.	Червь-Оплетай вот так вот прицепилась к Пиэтэру Бэрбэкину.	The Worm-Opletai stuck to Pieter Berbekin.	アプリタイがこのように抱きついた、ピエテル・ベルベキンに。	53(15.11)
15_ShAG20021012T-20	titāt kurgom jodutajm.	titāt kurgom jodutaj-m.	ANPH:ADV all.round wrap:PFV-IND.TR.3SG	Титаат кургом йодутайм.	Вот так вот обвилась.	She twined around him.	このように巻きついた。	53(15.12)
15_ShAG20021012T-21	d'e qoni.	d'e qon-i.	INTJ go-IND.INTR.3SG	Дьэ хони.	Он шёл.	He went on.	彼は歩いた。	53(15.13)
15_ShAG20021012T-22	ele–ele qoni.	ele–ele qon-i.	hardly(Rus.) go-IND.INTR.3SG	Еле-еле хони.	Он еле-еле зашагал.	He could hardly walk.	やっとのことで歩いた。	53(15.13)
15_ShAG20021012T-23	pieter_berbekin moni:	pieter_berbekin mon-i:	Pieter.Berbekin say-IND.INTR.3SG	Пиэтэр Бэрбэкин мони:	Пиэтэр Бэрбэкин сказал:	Pieter Berbekin said,	ピエテル・ベルベキンは言った：	53(15.14)
15_ShAG20021012T-24	“titāt ahurpel keriete ōžīge ot_keriete amdett'e!”	“titāt ahurpe-l keriete ōžī-ge ot=keriete amde-tt'e!”	ANPH:ADV suffer-AN than water-LOC HYP=than die-FUT:IND.INTR.1SG	«Титаат аҕурпэл кэриэтэ оожиигэ от кэриэтэ амдэтчэ!»	«Вместо того, чтобы так страдать, лучше было бы умереть в воде!»	“Instead of suffering so much, it would be better to die in water!”	「こんな風に苦しむよりも、水の中で死ねたらいいのに」	53(15.14)
15_ShAG20021012T-25	“ā met ōžī el_iŋije,” moni.	“ā met ōžī el=iŋi-je,” mon-i.	INTJ 1SG water NEG=be.afraid.of-IND.INTR.1SG say-IND.INTR.3SG	«Аа, мэт оожии эл иӈийэ», — мони.	«А-а, а я не боюсь воды».	“Ah, I am not afraid of water.”	「ああ、わたしは水は恐くない」	53(15.15)
15_ShAG20021012T-26	“tāt ahurpel keriete lot'ilge et_piedeje!”	“tāt ahurpe-l keriete lot'il-ge et=piede-je!”	ANPH:ADV suffer-AN than fire-LOC HYP=burn-IND.INTR.1SG	«Таат аҕурпэл кэриэтэ лочилгэ эт пиэдэйэ!»	«Вместо того, чтобы так страдать, лучше было бы сгореть в огне!»	“Instead of suffering so much, it would be better to be burnt in a fire!”	「こんな風に苦しむよりも、火の中で燃えることができたらいいのに！」	53(15.16)
15_ShAG20021012T-27	“ā met lot'il el_iŋije,” moni.	“ā met lot'il el=iŋi-je,” mon-i.	INTJ 1SG fire NEG=be.afraid.of-IND.INTR.1SG say-IND.INTR.3SG	«Аа, мэт лочил эл иӈийэ», — мони.	«А-а, а я не боюсь огня».	“Ah, but I am not afraid of fire.”	「ああ、わたしは火は恐くない」	54(15.17)
15_ShAG20021012T-28	a apl'etāj tāt jodōj.	a apl'etāj tāt jodō-j.	and(Rus.) opletaj ANPH:ADV wrap:RES-IND.INTR.3SG	А Апльэтаай таат йодоой.	Оплетай была обвита вокруг него.	Opletai was twined round him.	アプリタイは巻きついていた。	54(15.18)
15_ShAG20021012T-29	“tāt ahurpel keriete,” moni, “l'ege, šibit'e nonoho šibit'e no šibit'e legut et_ewreje,” moni, “šibit'e nono molhodoho.”	“tāt ahurpe-l keriete,” mon-i, “l'e-ge, šibit'e nono-ho šibit'e no šibit'e leg-u-t et=ewre-je,” mon-i, “šibit'e nono molho-do-ho.”	ANPH:ADV suffer-AN than say-IND.INTR.3SG that.one-LOC dog.rose bush.trunk-LOC dog.rose {} dog.rose eat-E-SS HYP=walk-IND.INTR.1SG say-IND.INTR.3SG dog.rose bush.trunk inside-POSS.3-LOC	«Таат аҕурпэл кэриэтэ, — мони, — льэгэ, шибичэ ноноҕо шибичэ но... шибичэ лэгут эт эурэйэ, — мони, — шибичэ ноно молҕодоҕо».	«Вместо того, чтобы так страдать, походить что ли по кустам шиповника, кушая ягоды?» — сказал он.	“Instead of suffering so much, shall I walk round dog rose bushes, eating hips?” he said.	「こんな風に苦しむよりも、ノイバラのとげの中を、ノイバラを食べながら歩こうか、ノイバラのとげの中を」	54(15.19)
15_ShAG20021012T-30	“monohott'ok,” moni, “pieter_berbekin?”	“monohot-t'ok,” mon-i, “pieter_berbekin?”	say.what-IND.INTR.2SG say-IND.INTR.3SG Pieter.Berbekin	«Моноҕотчок, — мони, — Пиэтэр Бэрбэкин?»	«Что ты сказал, Пиэтэр Бэрбэкин?»	“What did you say, Pieter Berbekin?”	「何だって、ピエテル・ベルベキン？」	54(15.2)
15_ShAG20021012T-31	“ā, šibit'e nono molho ewret šibit'e legude et_ewreje.”	“ā, šibit'e nono molho ewre-t šibit'e leg-u-de et=ewre-je.”	INTJ dog.rose bush.trunk in walk-SS dog.rose eat-E-SS.SIM HYP=walk-IND.INTR.1SG	«Аа, шибичэ ноно молҕо эурэт шибичэ лэгудэ эт эурэйэ».	«Как было бы хорошо ходить по кустам шиповника и есть ягоды шиповника».	“It would be so nice to walk round dog rose bushes and eat hips.”	「ノイバラの幹の中を、ノイバラを食べながら歩けたらいいのに」	54(15.21)
15_ShAG20021012T-32	“ōj el_qolloq,” moni.	“ōj el=qol-loq,” mon-i.	INTJ NEG=go-PROH.2SG say-IND.INTR.3SG	«Оой эл холлох, — мони.	«О-о, не ходи, пожалуйста.	“Oh, don't go.	「おお、行かないでくれ。	54(15.22)
15_ShAG20021012T-33	“el_qolloq.	“el=qol-loq.	NEG=go-PROH.2SG	— Эл холлох.	Не ходи.	Don't go.	​行かないでくれ。	54(15.22)
15_ShAG20021012T-34	tet šibit'eŋin el_qolloq!	tet šibit'e-ŋin el=qol-loq!	2SG dog.rose-DAT NEG=go-PROH.2SG	Тэт шибичэӈин эл холлох!	В кусты шиповника не ходи!	Don't go to dog rose bushes!	ノイバラのところへ行かないでくれ！	54(15.22)
15_ShAG20021012T-35	tamun nit'ahajŋi, taŋ l'egi, nonogi.”	tamun nit'ahaj-ŋi, taŋ l'e-gi, nono-gi.”	DST stick:PFV-PL:IND.INTR.3 DST.ATTR that.one-POSS.3 bush.trunk-POSS.3	Тамун ничаҕайӈи, таӈ льэги, ноноги».	Ветки колются».	The twigs are prickly.”	刺さるんだ、その幹は」	54(15.22)
15_ShAG20021012T-36	ē d'e iŋlīmelebengele nugum_el'e.	ē d'e iŋlī-mele=ben-gele nug-u-m=el'e.	INTJ INTJ frighten-MPTCP.3SG=NMLZ-ACC find-E-IND.TR.3SG=SFC	Ээ, дьэ иӈлиимэлэ бэнгэлэ нугум эльэ!	Нашёл, чем её напугать!	He found out what frightened her!	彼は恐ろしがらせるものを見つけたんだよ。	54(15.23)
15_ShAG20021012T-37	d'e šibit'e nonot'āŋin kebet'.	d'e šibit'e nono-t'ā-ŋin kebe-t'.	INTJ dog.rose bush.trunk-AGG-DAT leave:PFV-IND.INTR.3SG	Дьэ шибичэ ноночааӈин кэбэч.	Он пошёл в кусты шиповника.	He went to dog rose bushes.	ノイバラの茂みへ行った。	54(15.24)
15_ShAG20021012T-38	taŋide qoni.	taŋide qon-i.	DST.DIR go-IND.INTR.3SG	Таӈидэ хони.	Он пошёл туда.	He went there.	（彼は）そこへ行った。	54(15.25)
15_ShAG20021012T-39	ē, (xxx) šālge menmeget'.	ē, (xxx) šāl-ge menmege-t'.	INTJ {} tree-LOC jump:PFV-IND.INTR.3SG	Ээ, ??? шаалгэ мэнмэгэч.	Она запрыгнула на дерево.	She jumped to a tree.	アプリタイは木に飛びついた。	54(15.25)
15_ShAG20021012T-40	t'irt'eget'.	t'irt'ege-t'.	jump:PFV-IND.INTR.3SG	Чирчэгэч.	Запрыгнула.	She jumped.	飛びついた。	54(15.26)
15_ShAG20021012T-41	šālge jodāt'.	šāl-ge jodā-t'.	tree-LOC turn:PFV-IND.INTR.3SG	Шаалгэ йодаач.	Обвилась вокруг дерева.	And she twined around the tree.	そして木に巻きついた。	54(15.26)
15_ShAG20021012T-42	d'e pieter_berbekin nugum_el'e, iŋlīmelebengele.	d'e pieter_berbekin nug-u-m=el'e, iŋlī-mele=ben-gele.	INTJ Pieter.Berbekin find-E-IND.TR.3SG=SFC frighten-MPTCP.3SG=NMLZ-ACC	Дьэ Пиэтэр Бэрбэкин нугум эльэ, иӈлиимэлэ бэнгэлэ.	Пиэтэр Бэрбэкин нашёл, чем её напугать.	Pieter Berbekin found out what frightened her.	ピエテル・ベルベキンは見つけたんだよ、アプリタイを恐ろしがらせるものを。	54(15.27)
15_ShAG20021012T-43	nit'ahajŋi, qode emledejtem.	nit'ahaj-ŋi, qode emledej-tem.	stick:PFV-PL:IND.INTR.3 how embrace-FUT:IND.TR.3SG	Ничаҕайӈи, ходэ эмлэдэйтэм.	(Шиповник) цепляется и колется.	A dog rose clings and pricks.	絡みつくと刺さるんだ。	54(15.27)
15_ShAG20021012T-44	tāt qonut qonut qonut qonut qonut.	tāt qon-u-t qon-u-t qon-u-t qon-u-t qon-u-t.	ANPH:ADV go-E-SS go-E-SS go-E-SS go-E-SS go-E-SS	Таат хонут хонут хонут хонут хонут:	Пиэтэр Бэрбэкин шёл, шёл, шёл, шёл, шёл ...	Pieter Berbekin walked, walked, walked, walked, and walked ... Opletai said,	そしてずっと行った。	54(15.28)
15_ShAG20021012T-45	“ē, metket kebejek,” moni.	“ē, met-ket kebe-jek,” mon-i.	INTJ 1SG-ABL leave-IND.INTR.2SG say-IND.INTR.3SG	«Ээ, мэткэт кэбэйэк, — мони.	Оплетай сказала: «Э-э, от меня убежал.	“Eh, you've escaped from me.	（アプリタイは言った） — おまえはわたしからは逃げた。	54(15.28)
15_ShAG20021012T-46	“l'ege met pābāget el_pon'ōtejek.	“l'e-ge met pābā-get el=pon'ō-tejek.	that.one-LOC 1SG elder.sister-ABL NEG=remain-FUT:IND.INTR.2SG	— Льэгэ мэт паабаагэт эл поньоотэйэк.	Но не убежишь (букв. останешься) от моей старшей сестры.	But you'll not escape (lit. will stay) from my elder sister.	（しかし）わたしの姉からは助からないだろう。	54(15.28)
